{
  "$schema":"https://json-schema.org/draft/2020-12/schema",
  "$id":"https://example.invalid/ai-creative-skill/web-delivery-v0.2.1-candidate",
  "title":"Web Experience v0.2 delivery record · candidate, not production authority",
  "type":"object","additionalProperties":false,
  "required":["schema_version","route","mode","project","build_version","state","verdict","execution","WEB_BRIEF","WEB_DIRECTION","WEB_ASSET_PLAN","WEB_PREVIEW_BUILD","WEB_QA"],
  "properties":{
    "schema_version":{"enum":["0.2.0","0.2.1-candidate"]},
    "route":{"enum":["WEB_PREVIEW","WEB_EDIT","WEB_CONCEPT_ONLY","WEB_RESEARCH_ONLY","WEB_PUBLICATION"]},
    "mode":{"enum":["FAST","DEEP"]},
    "project":{"type":"string","minLength":1},
    "build_version":{"type":"string","minLength":1},
    "state":{"enum":["BRIEF_RECOVERED","DIRECTION_PROVISIONAL","ASSETS_READY","ASSETS_PARTIAL","PREVIEW_DRAFT","PREVIEW_REVIEWED","REVISION_REQUESTED","PREVIEW_ACCEPTED","PUBLICATION_PREFLIGHT","PUBLICATION_APPROVED","LIVE_VERIFIED"]},
    "verdict":{"enum":["PASS","PARTIAL","BLOCKED","UNVERIFIED"]},
    "execution":{"type":"object","additionalProperties":false,"required":["execution_mode","skill_package_version","methods","tools","paid_authorized","public_deploy_authorized"],"properties":{
      "execution_mode":{"enum":["MANUAL_SPEC_GUIDED","WEB_MODULE_EXECUTED"]},
      "skill_package_version":{"type":"string","minLength":1},
      "methods":{"type":"array","items":{"type":"object","required":["name","state"],"properties":{"name":{"type":"string"},"state":{"enum":["DOCUMENTED","AVAILABLE","EXECUTED"]}},"additionalProperties":false}},
      "tools":{"type":"array","items":{"type":"string"}},
      "paid_authorized":{"type":"boolean"},"public_deploy_authorized":{"type":"boolean"},
      "activation_evidence":{"type":["string","null"]}
    }},
    "WEB_BRIEF":{"type":"object","additionalProperties":false,"required":["deliverable_scope","business_kind","user_goal","audience_basis","product_service_truth_refs","known_unknown_boundary","brand_authority_state","primary_action_intent","task_completion_condition"],"properties":{
      "deliverable_scope":{"type":"string","minLength":1},"business_kind":{"enum":["PHYSICAL_PRODUCT","SERVICE","DIGITAL_PRODUCT","CREATOR","IDEA"]},"user_goal":{"type":"string","minLength":1},"audience_basis":{"type":"string","minLength":1},"product_service_truth_refs":{"type":"array","minItems":1,"items":{"type":"string"}},"known_unknown_boundary":{"type":"array","minItems":1,"items":{"type":"string"}},"brand_authority_state":{"enum":["EXISTING_APPROVED","EXISTING_MIXED","PROVISIONAL","UNKNOWN"]},"primary_action_intent":{"type":"string","minLength":1},"task_completion_condition":{"type":"string","minLength":1},"current_brand_refs":{"type":"array","items":{"type":"string"}},"regulated_claim_boundary":{"type":"string"},"product_material_scale_truth_state":{"type":"string"},"persona_canon_disclosure_refs":{"type":"array","items":{"type":"string"}},"proposed_function_hypothesis":{"type":["string","null"]}
    }},
    "WEB_DIRECTION":{"type":"object","additionalProperties":false,"required":["value_proposition","primary_cta_intent","sections_and_purpose","visual_direction","creative_open_zones","brand_alignment","claim_and_offer_boundaries"],"properties":{
      "value_proposition":{"type":"string","minLength":1},"primary_cta_intent":{"type":"string","minLength":1},"sections_and_purpose":{"type":"array","minItems":1,"items":{"type":"object","required":["id","purpose"],"properties":{"id":{"type":"string"},"purpose":{"type":"string"}},"additionalProperties":false}},"visual_direction":{"type":"string","minLength":1},"creative_open_zones":{"type":"array","items":{"type":"string"}},"brand_alignment":{"type":"string","minLength":1},"claim_and_offer_boundaries":{"type":"string","minLength":1},"motion_fallback_and_controls":{"type":"string"},"approved_reference_scope":{"type":"array","items":{"type":"string"}}
    }},
    "WEB_ASSET_PLAN":{"type":"object","additionalProperties":false,"required":["assets_used","asset_authority_and_rights","generation_required_decision","product_identity_preservation","provisional_vs_approved_labels"],"properties":{
      "assets_used":{"type":"array","items":{"type":"object","required":["path","origin","approval","rights","use_scope"],"properties":{"path":{"type":"string"},"origin":{"type":"string"},"approval":{"enum":["APPROVED_FOR_THIS_USE","PROVISIONAL","LEGACY","UNKNOWN"]},"rights":{"enum":["CLEARED","UNKNOWN","RESTRICTED"]},"use_scope":{"type":"string"},"publication_clearance":{"$ref":"#/$defs/publication_clearance"}},"additionalProperties":false}},
      "asset_authority_and_rights":{"type":"string"},"generation_required_decision":{"type":"string"},"product_identity_preservation":{"type":"string"},"provisional_vs_approved_labels":{"type":"string"},"budget_and_explicit_approval_ref":{"type":"string"},"observed_vs_unknown_photo_claims":{"type":"string"},"logo_provisional_status":{"type":"string"}
    }},
    "WEB_PREVIEW_BUILD":{"type":"object","additionalProperties":false,"required":["preview_status","source_files","verified_preview_ref_or_local_open_instructions","responsive_strategy","working_interactions","primary_cta_behavior","real_vs_mock_integrations","version_id","form_mode"],"properties":{
      "preview_status":{"enum":["AVAILABLE_VERIFIED","AVAILABLE_UNVERIFIED","UNAVAILABLE","NOT_BUILT"]},"source_files":{"type":"array","items":{"type":"string"}},"verified_preview_ref_or_local_open_instructions":{"type":"string"},"responsive_strategy":{"type":"string"},"working_interactions":{"type":"array","items":{"type":"string"}},"primary_cta_behavior":{"enum":["REAL_VERIFIED_LINK","SAFE_LOCAL_DEMO","CONTACT_LINK_VERIFIED","WAITLIST_NOT_CONNECTED","MOCK_FORM_LABELED","DISABLED_PENDING_DESTINATION"]},"real_vs_mock_integrations":{"type":"string"},"version_id":{"type":"string"},"form_mode":{"enum":["NONE","LOCAL_CALCULATION","EXTERNAL_SUBMISSION","MOCK_INPUT"]},"form_destination":{"type":["string","null"]},"prefers_reduced_motion_fallback":{"type":["string","null"]},"external_link_targets":{"type":"array","items":{"type":"string"}},"integration_and_permission_state":{"type":"string"},"preview_lifecycle_ref":{"type":["string","null"]}
    }},
    "WEB_QA":{"type":"object","additionalProperties":false,"required":["checks","known_limitations","verdict"],"properties":{
      "checks":{"type":"array","items":{"$ref":"#/$defs/check"}},"known_limitations":{"type":"array","items":{"type":"string"}},"verdict":{"enum":["PASS","PARTIAL","BLOCKED","UNVERIFIED"]}
    }},
    "WEB_REVISION":{"type":"object","additionalProperties":false,"required":["parent_version_ref","requested_change","preserve_regions","vary_regions","implemented_delta","affected_qa_checks","new_preview_ref_or_partial_status"],"properties":{"parent_version_ref":{"type":"string"},"requested_change":{"type":"string"},"preserve_regions":{"type":"array","items":{"type":"string"}},"vary_regions":{"type":"array","items":{"type":"string"}},"implemented_delta":{"type":"string"},"affected_qa_checks":{"type":"array","items":{"type":"string"}},"new_preview_ref_or_partial_status":{"type":"string"},"approval_reference":{"type":["string","null"]}}},
    "publication_approval_ref":{"type":"string"}
  },
  "$defs":{"publication_clearance":{"type":"object","additionalProperties":false,"required":["allowed_uses","conditions_status","evidence_ref","evidence_sha256","asset_sha256","reviewed_by"],"properties":{"allowed_uses":{"type":"array","minItems":1,"uniqueItems":true,"items":{"enum":["public_website","commercial_publication","web_publication"]}},"conditions_status":{"enum":["SATISFIED","PENDING","NOT_APPLICABLE"]},"evidence_ref":{"type":"string","minLength":1},"evidence_sha256":{"type":"string","pattern":"^[a-f0-9]{64}$"},"asset_sha256":{"type":"string","pattern":"^[a-f0-9]{64}$"},"reviewed_by":{"type":"string","pattern":"\\S"}}},"check":{"type":"object","additionalProperties":false,"required":["check_id","requirement","criticality","procedure","result","evidence_mode","evidence_ref","build_hash","viewport","checked_at"],"properties":{"check_id":{"type":"string","minLength":1},"requirement":{"type":"string","minLength":1},"criticality":{"enum":["CRITICAL","ESSENTIAL","ADVISORY"]},"procedure":{"type":"string","minLength":1},"result":{"enum":["PASS","FAIL","NOT_TESTED","NOT_APPLICABLE"]},"evidence_mode":{"enum":["BROWSER_OBSERVED","STATIC_INSPECTED","HUMAN_REVIEWED","NONE"]},"evidence_ref":{"type":["string","null"]},"build_hash":{"type":"string"},"viewport":{"type":["string","null"]},"checked_at":{"type":"string"},"reason":{"type":"string"}}}},
  "allOf":[{"if":{"properties":{"schema_version":{"const":"0.2.0"}}},"then":{"properties":{"WEB_ASSET_PLAN":{"properties":{"assets_used":{"items":{"not":{"required":["publication_clearance"]}}}}}}}},{"if":{"properties":{"route":{"const":"WEB_EDIT"}}},"then":{"required":["WEB_REVISION"]}},{"if":{"properties":{"state":{"enum":["PUBLICATION_APPROVED","LIVE_VERIFIED"]}}},"then":{"required":["publication_approval_ref"]}}]
}
