{
 "schema_version": "0.2.0",
 "route": "WEB_PREVIEW",
 "mode": "FAST",
 "project": "Miolo (fictícia) · DQB-02 m13",
 "build_version": "r0",
 "state": "PREVIEW_REVIEWED",
 "verdict": "PARTIAL",
 "execution": {
  "execution_mode": "MANUAL_SPEC_GUIDED",
  "skill_package_version": "2.5.0",
  "methods": [
   {
    "name": "AI_Creative_Skill_Work_Profile_Web_Experience_v0.2",
    "state": "EXECUTED"
   },
   {
    "name": "AI_Creative_Skill_Deliverable_Completeness_Catalog_Pre-v0.1-V2.4-CANDIDATE",
    "state": "DOCUMENTED"
   }
  ],
  "tools": [
   "file write/edit",
   "bash",
   "python3 Playwright Chromium",
   "scripts/creative_web.py route/audit/validate"
  ],
  "paid_authorized": false,
  "public_deploy_authorized": false,
  "activation_evidence": "Agente leu SKILL.md e o Work Profile Web v0.2 e seguiu manualmente; route --intent WEB_PREVIEW retornou FAST/build_required"
 },
 "WEB_BRIEF": {
  "deliverable_scope": "Site navegável local com home, fornada filtrável, detalhe por produto, encomenda demonstrativa com horário e resumo, créditos",
  "business_kind": "PHYSICAL_PRODUCT",
  "user_goal": "Vizinhos sabem o que haverá na fornada de sábado e montam uma encomenda demonstrativa",
  "audience_basis": "briefing.md: vizinhos de 25–55 anos no bairro fictício Vale",
  "product_service_truth_refs": [
   "briefing.md tabela de produtos",
   "assets/credits.json"
  ],
  "known_unknown_boundary": [
   "Ingredientes além da descrição: UNKNOWN, não alegados",
   "Alérgenos: indisponíveis (aviso)",
   "Endereço exato: UNKNOWN; só 'Vale'"
  ],
  "brand_authority_state": "PROVISIONAL",
  "primary_action_intent": "Ver a fornada → montar encomenda demonstrativa",
  "task_completion_condition": "Preview local navegável em r0/index.html com QA desktop/mobile",
  "product_material_scale_truth_state": "Nomes, categorias, preços, unidades e descrições exatamente do briefing; nenhuma outra alegação. Fotos de terceiros ilustrativas."
 },
 "WEB_DIRECTION": {
  "value_proposition": "O pão de sábado começa na sexta: encomende até sexta 18h, retire sábado 8h–12h",
  "primary_cta_intent": "Ver a fornada",
  "sections_and_purpose": [
   {
    "id": "hero",
    "purpose": "proposta + CTA"
   },
   {
    "id": "como-funciona",
    "purpose": "régua temporal sexta→sábado em 3 passos"
   },
   {
    "id": "destaque",
    "purpose": "três itens da fornada + link para os cinco"
   },
   {
    "id": "a-padaria",
    "purpose": "funcionamento"
   },
   {
    "id": "fornada",
    "purpose": "catálogo filtrável"
   },
   {
    "id": "produto",
    "purpose": "detalhe e adicionar"
   },
   {
    "id": "encomenda",
    "purpose": "ficha, horário, revisão"
   },
   {
    "id": "creditos",
    "purpose": "autoria e licenças"
   }
  ],
  "visual_direction": "'Ficha de fornada': papel creme, tinta marrom-casca, acento vermelho de toalha xadrez das próprias fotos; Fraunces (títulos, itálico de forno) + Instrument Sans + IBM Plex Mono para horários/preços; recorte em arco (boca de forno) como enquadramento recorrente das fotos; régua temporal como motivo de processo.",
  "creative_open_zones": [
   "paleta",
   "tipografia",
   "wordmark",
   "composição"
  ],
  "brand_alignment": "Nome Miolo e assinatura fixos preservados; wordmark tipográfico provisório",
  "claim_and_offer_boundaries": "Sem escassez, depoimentos, prêmios, ingredientes extras, orgânico/artesanal; sorvete do bolo explicitamente não incluso",
  "motion_fallback_and_controls": "Transições curtas; prefers-reduced-motion zera animações/transições",
  "approved_reference_scope": [
   "references/warm-organic e editorial-brand-led observadas só por dimensão (calor de fundo creme; serifa grande); nada de layout, logo ou ilustração herdado"
  ]
 },
 "WEB_ASSET_PLAN": {
  "assets_used": [
   {
    "path": "r0/assets/apple-cake-with-vanilla-ice-cream-1.jpg",
    "origin": "Wikimedia Commons, W.carter",
    "approval": "PROVISIONAL",
    "rights": "CLEARED",
    "use_scope": "ilustração demonstrativa com créditos"
   },
   {
    "path": "r0/assets/apple-cake-with-vanilla-ice-cream-2.jpg",
    "origin": "Wikimedia Commons, W.carter",
    "approval": "PROVISIONAL",
    "rights": "CLEARED",
    "use_scope": "ilustração demonstrativa com créditos"
   },
   {
    "path": "r0/assets/cardamom-buns-on-grate-under-towel.jpg",
    "origin": "Wikimedia Commons, W.carter",
    "approval": "PROVISIONAL",
    "rights": "CLEARED",
    "use_scope": "ilustração demonstrativa com créditos"
   },
   {
    "path": "r0/assets/cardamom-buns.jpg",
    "origin": "Wikimedia Commons, W.carter",
    "approval": "PROVISIONAL",
    "rights": "CLEARED",
    "use_scope": "ilustração demonstrativa com créditos"
   },
   {
    "path": "r0/assets/one-layer-of-cardamom-buns-on-grate.jpg",
    "origin": "Wikimedia Commons, W.carter",
    "approval": "PROVISIONAL",
    "rights": "CLEARED",
    "use_scope": "ilustração demonstrativa com créditos"
   },
   {
    "path": "r0/assets/plain-vanilla-muffin.jpg",
    "origin": "Wikimedia Commons, W.carter",
    "approval": "PROVISIONAL",
    "rights": "CLEARED",
    "use_scope": "ilustração demonstrativa com créditos"
   },
   {
    "path": "r0/assets/plain-vanilla-muffins-1.jpg",
    "origin": "Wikimedia Commons, W.carter",
    "approval": "PROVISIONAL",
    "rights": "CLEARED",
    "use_scope": "ilustração demonstrativa com créditos"
   },
   {
    "path": "r0/assets/plain-vanilla-muffins-2.jpg",
    "origin": "Wikimedia Commons, W.carter",
    "approval": "PROVISIONAL",
    "rights": "CLEARED",
    "use_scope": "ilustração demonstrativa com créditos"
   },
   {
    "path": "r0/assets/plain-vanilla-muffins-3.jpg",
    "origin": "Wikimedia Commons, W.carter",
    "approval": "PROVISIONAL",
    "rights": "CLEARED",
    "use_scope": "ilustração demonstrativa com créditos"
   },
   {
    "path": "r0/assets/strawberry-pie-in-springform-pan-with-drip-tray-1.jpg",
    "origin": "Wikimedia Commons, W.carter",
    "approval": "PROVISIONAL",
    "rights": "CLEARED",
    "use_scope": "ilustração demonstrativa com créditos"
   },
   {
    "path": "r0/assets/strawberry-pie-in-springform-pan-with-drip-tray-2.jpg",
    "origin": "Wikimedia Commons, W.carter",
    "approval": "PROVISIONAL",
    "rights": "CLEARED",
    "use_scope": "ilustração demonstrativa com créditos"
   },
   {
    "path": "r0/assets/strawberry-pie-in-springform-pan-with-drip-tray-3.jpg",
    "origin": "Wikimedia Commons, W.carter",
    "approval": "PROVISIONAL",
    "rights": "CLEARED",
    "use_scope": "ilustração demonstrativa com créditos"
   },
   {
    "path": "r0/assets/swedish-cheese-scones.jpg",
    "origin": "Wikimedia Commons, W.carter",
    "approval": "PROVISIONAL",
    "rights": "CLEARED",
    "use_scope": "ilustração demonstrativa com créditos"
   },
   {
    "path": "r0/assets/two-layers-of-cardamom-buns-on-grate.jpg",
    "origin": "Wikimedia Commons, W.carter",
    "approval": "PROVISIONAL",
    "rights": "CLEARED",
    "use_scope": "ilustração demonstrativa com créditos"
   }
  ],
  "asset_authority_and_rights": "CC0/CC BY 4.0/CC BY-SA 4.0 conforme credits.json; créditos completos em #/creditos",
  "generation_required_decision": "Nenhuma geração; fotos sem alteração de pixels, recorte via object-fit",
  "product_identity_preservation": "Cada produto usa somente as fotos do seu tipo",
  "provisional_vs_approved_labels": "Wordmark e paleta provisórios",
  "observed_vs_unknown_photo_claims": "Bolo de maçã: sorvete visível, sinalizado como não incluso no card, detalhe, encomenda e resumo"
 },
 "WEB_PREVIEW_BUILD": {
  "preview_status": "AVAILABLE_VERIFIED",
  "source_files": [
   "r0/index.html",
   "r0/styles.css",
   "r0/app.js",
   "r0/credits-data.js",
   "r0/fonts/fonts.css"
  ],
  "verified_preview_ref_or_local_open_instructions": "Abrir file:///tmp/dqb/runs/m13/r0/index.html diretamente no navegador (sem servidor)",
  "responsive_strategy": "Grade 3→2→1 colunas; hero com foto acima do texto <860px; régua horizontal→vertical <720px; destaque em carrossel com scroll-snap <560px; encomenda em coluna única <1024px",
  "working_interactions": [
   "filtros",
   "galeria de miniaturas",
   "seletor de quantidade",
   "adicionar",
   "editar/remover linha",
   "horário obrigatório",
   "revisar/editar resumo",
   "rotas por hash com voltar/avançar"
  ],
  "primary_cta_behavior": "SAFE_LOCAL_DEMO",
  "real_vs_mock_integrations": "Nenhuma integração; estado em memória + localStorage opcional",
  "version_id": "r0",
  "form_mode": "LOCAL_CALCULATION",
  "form_destination": null,
  "prefers_reduced_motion_fallback": "animation/transition 0.001ms",
  "external_link_targets": [
   "creativecommons.org (licenças)",
   "commons.wikimedia.org (fontes), só na página de créditos"
  ]
 },
 "WEB_QA": {
  "checks": [
   {
    "check_id": "assets_available",
    "requirement": "Assets locais existem e carregam",
    "criticality": "ESSENTIAL",
    "procedure": "Playwright: imagens decodificadas, 0 requisições não-file",
    "result": "PASS",
    "evidence_mode": "BROWSER_OBSERVED",
    "evidence_ref": "evidence-r0/functional-results.json",
    "build_hash": "7779e6789012186e0b0e2ac41b432536fab6e305e8fc2b884624443d23cf0de6",
    "viewport": "1440x900, 390x844, 768x1024",
    "checked_at": "2026-10-21T00:11:16.419284+00:00"
   },
   {
    "check_id": "browser_render",
    "requirement": "Todas as rotas renderizam sem erro de console",
    "criticality": "CRITICAL",
    "procedure": "Playwright Chromium: 6 rotas × 3 viewports, sem pageerror/console error",
    "result": "PASS",
    "evidence_mode": "BROWSER_OBSERVED",
    "evidence_ref": "evidence-r0/functional-results.json",
    "build_hash": "7779e6789012186e0b0e2ac41b432536fab6e305e8fc2b884624443d23cf0de6",
    "viewport": "1440x900, 390x844, 768x1024",
    "checked_at": "2026-10-21T00:11:16.419284+00:00"
   },
   {
    "check_id": "desktop_render",
    "requirement": "Home/fornada/detalhe/encomenda legíveis em desktop, sem overflow",
    "criticality": "ESSENTIAL",